    No. Time        Source                Destination           Protocol Info
      1 0.000000    stl-m-wpy.htw-saarland.de stl-c-03.htw-saarland.de TELNET   Telnet Data ...
      2 0.000405    stl-c-03.htw-saarland.de stl-m-wpy.htw-saarland.de TELNET   Telnet Data ...
      3 0.050573    stl-m-wpy.htw-saarland.de stl-c-03.htw-saarland.de TCP      32981 > telnet [ACK] Seq=3570352743 Ack=4175747848 Win=32941 Len=0
      4 0.345893    stl-m-wpy.htw-saarland.de stl-c-03.htw-saarland.de TELNET   Telnet Data ...
      5 0.346185    stl-c-03.htw-saarland.de stl-m-wpy.htw-saarland.de TELNET   Telnet Data ...
      6 0.390550    stl-m-wpy.htw-saarland.de stl-c-03.htw-saarland.de TCP      32981 > telnet [ACK] Seq=3570352744 Ack=4175747849 Win=32941 Len=0
      7 1.400301    stl-m-wpy.htw-saarland.de stl-c-03.htw-saarland.de TELNET   Telnet Data ...
      8 1.400721    stl-c-03.htw-saarland.de stl-m-wpy.htw-saarland.de TELNET   Telnet Data ...
      9 1.450563    stl-m-wpy.htw-saarland.de stl-c-03.htw-saarland.de TCP      32981 > telnet [ACK] Seq=3570352746 Ack=4175747851 Win=32941 Len=0
     10 1.468831    stl-c-03.htw-saarland.de stl-m-wpy.htw-saarland.de TELNET   Telnet Data ...
     11 1.510562    stl-m-wpy.htw-saarland.de stl-c-03.htw-saarland.de TCP      32981 > telnet [ACK] Seq=3570352746 Ack=4175747907 Win=32941 Len=0
     12 1.510766    stl-c-03.htw-saarland.de stl-m-wpy.htw-saarland.de TELNET   Telnet Data ...
     13 1.560555    stl-m-wpy.htw-saarland.de stl-c-03.htw-saarland.de TCP      32981 > telnet [ACK] Seq=3570352746 Ack=4175747948 Win=32941 Len=0
     14 11.579569   stl-m-wpy.htw-saarland.de stl-c-03.htw-saarland.de TELNET   Telnet Data ...
     15 11.580123   stl-c-03.htw-saarland.de stl-m-wpy.htw-saarland.de TELNET   Telnet Data ...
     16 11.620528   stl-m-wpy.htw-saarland.de stl-c-03.htw-saarland.de TCP      32981 > telnet [ACK] Seq=3570352755 Ack=4175747957 Win=32941 Len=0
     17 13.032867   stl-m-wpy.htw-saarland.de stl-c-03.htw-saarland.de TELNET   Telnet Data ...
     18 13.035867   stl-c-03.htw-saarland.de stl-m-wpy.htw-saarland.de TELNET   Telnet Data ...
     19 13.080551   stl-m-wpy.htw-saarland.de stl-c-03.htw-saarland.de TCP      32981 > telnet [ACK] Seq=3570352757 Ack=4175747998 Win=32941 Len=0
     20 23.501979   stl-m-wpy.htw-saarland.de stl-c-03.htw-saarland.de TELNET   Telnet Data ...
     21 23.502399   stl-c-03.htw-saarland.de stl-m-wpy.htw-saarland.de TELNET   Telnet Data ...
     22 23.550565   stl-m-wpy.htw-saarland.de stl-c-03.htw-saarland.de TCP      32981 > telnet [ACK] Seq=3570352767 Ack=4175748008 Win=32941 Len=0
     23 23.550791   stl-c-03.htw-saarland.de stl-m-wpy.htw-saarland.de TELNET   Telnet Data ...
     24 23.610569   stl-m-wpy.htw-saarland.de stl-c-03.htw-saarland.de TCP      32981 > telnet [ACK] Seq=3570352767 Ack=4175748120 Win=32885 Len=0
     25 27.826939   stl-m-wpy.htw-saarland.de stl-c-03.htw-saarland.de TELNET   Telnet Data ...
     26 27.827362   stl-c-03.htw-saarland.de stl-m-wpy.htw-saarland.de TELNET   Telnet Data ...
     27 27.838313   stl-c-03.htw-saarland.de stl-m-wpy.htw-saarland.de TCP      telnet > 32981 [FIN, ACK] Seq=4175748126 Ack=3570352773 Win=33258 Len=0
     28 27.838427   stl-m-wpy.htw-saarland.de stl-c-03.htw-saarland.de TCP      32981 > telnet [ACK] Seq=3570352773 Ack=4175748127 Win=32885 Len=0
     29 27.838897   stl-m-wpy.htw-saarland.de stl-c-03.htw-saarland.de TCP      32981 > telnet [FIN, ACK] Seq=3570352773 Ack=4175748127 Win=32885 Len=0
     30 27.839092   stl-c-03.htw-saarland.de stl-m-wpy.htw-saarland.de TCP      telnet > 32981 [ACK] Seq=4175748127 Ack=3570352774 Win=33258 Len=0
